{
  "schema_version": "2.0.0",
  "institution": "Maples Academy, Khatauli (District Muzaffarnagar, U.P. - 251201)",
  "club": "Maples Tech Club (MTC) — Learn it. Build it. Ship it.",
  "class": 10,
  "eligible_sections": [
    "A",
    "B"
  ],
  "selection_policy": {
    "mode": "random_shuffle_per_attempt",
    "minimum_bank_size": 100,
    "syllabus_free": true
  },
  "exam_defaults": {
    "total_questions_served": 25,
    "time_limit_minutes": 30,
    "passing_score": 18,
    "max_attempts": 1,
    "show_results_to_students": false
  },
  "categories": [
    "Keyboard Shortcuts",
    "Computer Hardware",
    "Application Software & OS",
    "Web Browsing & Internet",
    "Basic Networking & Connectivity",
    "Social Ethics & Cyber Safety"
  ],
  "total_questions_in_bank": 108,
  "questions": [
    {
      "code": "MTC-C10-Q001",
      "class": 10,
      "subject_tag": "Keyboard Shortcuts",
      "difficulty": "easy",
      "question_text": "Which key at the top-left of the keyboard is commonly pressed to cancel a pop-up or exit full-screen video?",
      "option_a": "Num Lock",
      "option_b": "Esc (Escape)",
      "option_c": "Tab",
      "option_d": "Insert",
      "correct_option": "b"
    },
    {
      "code": "MTC-C10-Q002",
      "class": 10,
      "subject_tag": "Keyboard Shortcuts",
      "difficulty": "easy",
      "question_text": "Which function key is the classic shortcut to REFRESH or reload a webpage in a browser?",
      "option_a": "F1",
      "option_b": "F5",
      "option_c": "F12",
      "option_d": "F2",
      "correct_option": "b"
    },
    {
      "code": "MTC-C10-Q003",
      "class": 10,
      "subject_tag": "Keyboard Shortcuts",
      "difficulty": "easy",
      "question_text": "If you pressed Ctrl + Z (Undo) by mistake and want your change back, which shortcut performs REDO?",
      "option_a": "Ctrl + Y",
      "option_b": "Ctrl + R",
      "option_c": "Ctrl + W",
      "option_d": "Ctrl + E",
      "correct_option": "a"
    },
    {
      "code": "MTC-C10-Q004",
      "class": 10,
      "subject_tag": "Keyboard Shortcuts",
      "difficulty": "easy",
      "question_text": "Which keyboard shortcut lets you quickly switch between open apps/windows on Windows?",
      "option_a": "Alt + Tab",
      "option_b": "Ctrl + C",
      "option_c": "Ctrl + P",
      "option_d": "Shift + Enter",
      "correct_option": "a"
    },
    {
      "code": "MTC-C10-Q005",
      "class": 10,
      "subject_tag": "Keyboard Shortcuts",
      "difficulty": "easy",
      "question_text": "To type a single capital letter or the \"@\" symbol above the number 2 without turning on Caps Lock, which key do you hold?",
      "option_a": "Shift",
      "option_b": "Tab",
      "option_c": "Alt",
      "option_d": "Ctrl",
      "correct_option": "a"
    },
    {
      "code": "MTC-C10-Q006",
      "class": 10,
      "subject_tag": "Keyboard Shortcuts",
      "difficulty": "easy",
      "question_text": "Which shortcut opens a brand-new blank document or window in most apps?",
      "option_a": "Ctrl + D",
      "option_b": "Ctrl + M",
      "option_c": "Ctrl + B",
      "option_d": "Ctrl + N",
      "correct_option": "d"
    },
    {
      "code": "MTC-C10-Q007",
      "class": 10,
      "subject_tag": "Keyboard Shortcuts",
      "difficulty": "easy",
      "question_text": "In a web browser like Chrome or Edge, what does pressing Ctrl + T do?",
      "option_a": "Opens a new browser tab",
      "option_b": "Translates the page",
      "option_c": "Turns off Wi-Fi",
      "option_d": "Closes the browser",
      "correct_option": "a"
    },
    {
      "code": "MTC-C10-Q008",
      "class": 10,
      "subject_tag": "Keyboard Shortcuts",
      "difficulty": "medium",
      "question_text": "In a web browser, what does pressing Ctrl + W do?",
      "option_a": "Turns the screen white",
      "option_b": "Closes only the current tab",
      "option_c": "Opens Microsoft Word",
      "option_d": "Saves all bookmarks",
      "correct_option": "b"
    },
    {
      "code": "MTC-C10-Q009",
      "class": 10,
      "subject_tag": "Keyboard Shortcuts",
      "difficulty": "medium",
      "question_text": "Which key on a Windows keyboard is used to capture a screenshot of your entire screen?",
      "option_a": "Pause/Break",
      "option_b": "PrtSc (Print Screen)",
      "option_c": "Scroll Lock",
      "option_d": "Page Down",
      "correct_option": "b"
    },
    {
      "code": "MTC-C10-Q010",
      "class": 10,
      "subject_tag": "Keyboard Shortcuts",
      "difficulty": "medium",
      "question_text": "When a file or folder is selected on Windows, pressing which function key lets you RENAME it immediately?",
      "option_a": "F1",
      "option_b": "F4",
      "option_c": "F8",
      "option_d": "F2",
      "correct_option": "d"
    },
    {
      "code": "MTC-C10-Q011",
      "class": 10,
      "subject_tag": "Keyboard Shortcuts",
      "difficulty": "medium",
      "question_text": "What does pressing Alt + F4 do on a Windows computer?",
      "option_a": "Opens four new folders",
      "option_b": "Closes the currently active app or window",
      "option_c": "Increases speaker volume",
      "option_d": "Turns on Bluetooth",
      "correct_option": "b"
    },
    {
      "code": "MTC-C10-Q012",
      "class": 10,
      "subject_tag": "Keyboard Shortcuts",
      "difficulty": "medium",
      "question_text": "In a browser, pressing Ctrl and the \"+\" (plus) key together does what?",
      "option_a": "Zooms in to make text and images appear larger",
      "option_b": "Adds a new user account",
      "option_c": "Opens calculator",
      "option_d": "Increases internet speed",
      "correct_option": "a"
    },
    {
      "code": "MTC-C10-Q013",
      "class": 10,
      "subject_tag": "Keyboard Shortcuts",
      "difficulty": "medium",
      "question_text": "After zooming in on a webpage, pressing Ctrl + 0 (zero) does what?",
      "option_a": "Mutes computer sound",
      "option_b": "Closes all tabs",
      "option_c": "Deletes the webpage",
      "option_d": "Resets the page zoom back to normal (100%)",
      "correct_option": "d"
    },
    {
      "code": "MTC-C10-Q014",
      "class": 10,
      "subject_tag": "Keyboard Shortcuts",
      "difficulty": "medium",
      "question_text": "When filling out an online form (like Name, Roll No, Class), pressing the Tab key usually does what?",
      "option_a": "Closes the browser tab",
      "option_b": "Erases what you typed",
      "option_c": "Moves the cursor neatly to the next input box",
      "option_d": "Submits the form immediately",
      "correct_option": "c"
    },
    {
      "code": "MTC-C10-Q015",
      "class": 10,
      "subject_tag": "Keyboard Shortcuts",
      "difficulty": "hard",
      "question_text": "If you step away from a computer for a minute, which Windows shortcut immediately LOCKS your screen?",
      "option_a": "Windows Key + O",
      "option_b": "Ctrl + L",
      "option_c": "Alt + L",
      "option_d": "Windows Key + L",
      "correct_option": "d"
    },
    {
      "code": "MTC-C10-Q016",
      "class": 10,
      "subject_tag": "Keyboard Shortcuts",
      "difficulty": "hard",
      "question_text": "Which Windows shortcut minimizes all open windows at once so you can see the Desktop?",
      "option_a": "Ctrl + D",
      "option_b": "Windows Key + D",
      "option_c": "Windows Key + P",
      "option_d": "Alt + D",
      "correct_option": "b"
    },
    {
      "code": "MTC-C10-Q017",
      "class": 10,
      "subject_tag": "Keyboard Shortcuts",
      "difficulty": "hard",
      "question_text": "You accidentally closed an important tab in Chrome/Edge! Which lifesaver shortcut reopens the last closed tab?",
      "option_a": "Alt + Home",
      "option_b": "Ctrl + Alt + Z",
      "option_c": "Ctrl + Shift + T",
      "option_d": "Shift + F5",
      "correct_option": "c"
    },
    {
      "code": "MTC-C10-Q018",
      "class": 10,
      "subject_tag": "Keyboard Shortcuts",
      "difficulty": "hard",
      "question_text": "What happens when you delete a file using Shift + Delete instead of just pressing Delete?",
      "option_a": "It copies the file twice",
      "option_b": "It moves the file to Desktop",
      "option_c": "Nothing happens",
      "option_d": "It permanently deletes the file without sending it to the Recycle Bin",
      "correct_option": "d"
    },
    {
      "code": "MTC-C10-Q019",
      "class": 10,
      "subject_tag": "Computer Hardware",
      "difficulty": "easy",
      "question_text": "Which single modern cable carries BOTH sharp high-definition video AND audio from a laptop to a TV or projector?",
      "option_a": "HDMI cable",
      "option_b": "Mouse wire",
      "option_c": "Earphone jack",
      "option_d": "Power cord",
      "correct_option": "a"
    },
    {
      "code": "MTC-C10-Q020",
      "class": 10,
      "subject_tag": "Computer Hardware",
      "difficulty": "easy",
      "question_text": "At a supermarket checkout or school library, which handheld device reads black-and-white striped labels instantly?",
      "option_a": "Barcode Scanner",
      "option_b": "Microphone",
      "option_c": "Joystick",
      "option_d": "Cooling Pad",
      "correct_option": "a"
    },
    {
      "code": "MTC-C10-Q021",
      "class": 10,
      "subject_tag": "Computer Hardware",
      "difficulty": "easy",
      "question_text": "Why can a laptop keep running during a power cut even without an external UPS?",
      "option_a": "Laptops have a built-in rechargeable battery inside",
      "option_b": "Laptops do not use electricity",
      "option_c": "The keyboard generates power",
      "option_d": "Laptops run on Wi-Fi waves",
      "correct_option": "a"
    },
    {
      "code": "MTC-C10-Q022",
      "class": 10,
      "subject_tag": "Computer Hardware",
      "difficulty": "easy",